{
  "$schema": "https://json-schema.org/draft/2020-12/schema",
  "$id": "https://raw.githubusercontent.com/Iron-Mark/Iron-Mark/main/public/schema/llms-index.schema.json",
  "title": "Iron-Mark llms-index.json",
  "description": "Machine-readable profile, proof, SEO, AEO, GEO, and citation index for Mark Siazon.",
  "type": "object",
  "required": [
    "version",
    "updated",
    "contentRoot",
    "license",
    "citation",
    "entity",
    "identifiers",
    "availability",
    "canonical",
    "machineReadable",
    "featuredProjects",
    "hackathonLab",
    "achievements",
    "coreStack",
    "stackReference",
    "seo",
    "aeo",
    "triples",
    "schema"
  ],
  "properties": {
    "$schema": {
      "type": "string",
      "format": "uri"
    },
    "version": {
      "type": "string",
      "pattern": "^\\d+\\.\\d+\\.\\d+$"
    },
    "updated": {
      "type": "string",
      "format": "date",
      "pattern": "^\\d{4}-\\d{2}-\\d{2}$"
    },
    "contentRoot": {
      "const": "public/"
    },
    "license": {
      "type": "string",
      "format": "uri"
    },
    "citation": {
      "type": "string",
      "format": "uri"
    },
    "entity": {
      "type": "object",
      "required": [
        "@type",
        "@id",
        "name",
        "description",
        "url",
        "email",
        "sameAs"
      ],
      "properties": {
        "@type": {
          "const": "Person"
        },
        "@id": {
          "type": "string",
          "format": "uri"
        },
        "name": {
          "type": "string",
          "minLength": 1
        },
        "alternateName": {
          "type": "array",
          "items": {
            "type": "string"
          }
        },
        "jobTitle": {
          "type": "array",
          "minItems": 1,
          "items": {
            "type": "string"
          }
        },
        "description": {
          "type": "string",
          "minLength": 40
        },
        "url": {
          "type": "string",
          "format": "uri"
        },
        "email": {
          "type": "string",
          "minLength": 3
        },
        "sameAs": {
          "type": "array",
          "minItems": 3,
          "items": {
            "type": "string",
            "format": "uri"
          }
        }
      },
      "additionalProperties": true
    },
    "identifiers": {
      "type": "object",
      "required": [
        "person",
        "portfolioWebsite",
        "githubProfilePage",
        "githubProfileIndex",
        "githubPagesMirror",
        "faqDocument",
        "structuredIndex",
        "indexSchema",
        "personSchema",
        "faqSchema"
      ],
      "additionalProperties": true
    },
    "availability": {
      "type": "object",
      "required": [
        "status",
        "focus",
        "engagement",
        "location",
        "areaServed",
        "remote",
        "contact",
        "recruiterBrief"
      ],
      "properties": {
        "status": {
          "type": "string"
        },
        "focus": {
          "type": "array",
          "minItems": 1,
          "items": {
            "type": "string"
          }
        },
        "engagement": {
          "type": "array",
          "minItems": 1,
          "items": {
            "type": "string"
          }
        },
        "location": {
          "type": "string"
        },
        "areaServed": {
          "type": "array",
          "minItems": 1,
          "items": {
            "type": "string"
          }
        },
        "remote": {
          "type": "boolean"
        },
        "contact": {
          "type": "string",
          "format": "uri"
        },
        "recruiterBrief": {
          "type": "string",
          "format": "uri"
        }
      },
      "additionalProperties": true
    },
    "canonical": {
      "type": "object",
      "required": [
        "portfolio",
        "githubProfileReadme",
        "techStack",
        "proofMatrix"
      ],
      "additionalProperties": true
    },
    "machineReadable": {
      "type": "object",
      "required": [
        "repo",
        "pages",
        "portfolio"
      ],
      "properties": {
        "repo": {
          "type": "object",
          "required": [
            "llmsTxt",
            "llmsFullTxt",
            "llmsIndexJson",
            "llmsCtxFullTxt",
            "faqMd",
            "recruiterMd",
            "proofMd",
            "profileMd",
            "readmeMd",
            "howToCiteMd",
            "licenseMd",
            "citationCff",
            "schemaPerson",
            "schemaFaq",
            "schemaIndex",
            "humansTxt",
            "stackMd",
            "sitemap",
            "robots"
          ],
          "additionalProperties": true
        },
        "pages": {
          "type": "object",
          "required": [
            "home",
            "llmsTxt",
            "llmsFullTxt",
            "llmsIndexJson",
            "llmsCtxFullTxt",
            "faqMd",
            "recruiterMd",
            "proofMd",
            "profileMd",
            "readmeMd",
            "howToCiteMd",
            "licenseMd",
            "citationCff",
            "schemaPerson",
            "schemaFaq",
            "schemaIndex",
            "humansTxt",
            "stackMd",
            "sitemap",
            "robots"
          ],
          "additionalProperties": true
        },
        "portfolio": {
          "type": "object",
          "required": [
            "llmsTxt",
            "llmsFullTxt",
            "humansTxt",
            "sitemap",
            "rss",
            "jsonFeed"
          ],
          "additionalProperties": true
        }
      },
      "additionalProperties": false
    },
    "featuredProjects": {
      "type": "array",
      "minItems": 9,
      "items": {
        "type": "object",
        "required": [
          "name",
          "slug",
          "caseStudy",
          "focus"
        ],
        "properties": {
          "name": {
            "type": "string",
            "minLength": 1
          },
          "slug": {
            "type": "string",
            "pattern": "^[a-z0-9][a-z0-9-]*$"
          },
          "caseStudy": {
            "type": "string",
            "format": "uri"
          },
          "focus": {
            "type": "string",
            "minLength": 5
          }
        },
        "additionalProperties": true
      }
    },
    "hackathonLab": {
      "type": "array",
      "minItems": 1,
      "items": {
        "type": "object",
        "required": [
          "name",
          "focus"
        ],
        "properties": {
          "name": {
            "type": "string",
            "minLength": 1
          },
          "focus": {
            "type": "string",
            "minLength": 5
          },
          "caseStudy": {
            "type": "string",
            "format": "uri"
          },
          "repo": {
            "type": "string",
            "format": "uri"
          },
          "live": {
            "type": "string",
            "format": "uri"
          },
          "demo": {
            "type": "string",
            "format": "uri"
          }
        },
        "additionalProperties": true
      }
    },
    "achievements": {
      "type": "array",
      "items": {
        "type": "object",
        "required": [
          "title",
          "proof"
        ],
        "additionalProperties": true
      }
    },
    "coreStack": {
      "type": "array",
      "minItems": 10,
      "items": {
        "type": "string"
      }
    },
    "stackReference": {
      "type": "object",
      "required": [
        "file",
        "toolCount",
        "domains"
      ],
      "properties": {
        "file": {
          "type": "string",
          "pattern": "^STACK\\.md$"
        },
        "toolCount": {
          "type": "integer"
        },
        "domains": {
          "type": "array",
          "minItems": 5,
          "items": {
            "type": "string"
          }
        }
      },
      "additionalProperties": true
    },
    "seo": {
      "type": "object",
      "required": [
        "primaryKeywords",
        "geoTargets",
        "technicalSignals",
        "geoSignals",
        "generativeSearch"
      ],
      "properties": {
        "primaryKeywords": {
          "type": "array",
          "minItems": 10,
          "items": {
            "type": "string",
            "minLength": 2
          }
        },
        "geoTargets": {
          "type": "array",
          "minItems": 3,
          "items": {
            "type": "string",
            "minLength": 2
          }
        },
        "technicalSignals": {
          "type": "object",
          "required": [
            "canonicalPersonId",
            "canonicalPortfolio",
            "schemaGraphs",
            "sitemaps",
            "robots",
            "pagesMirror"
          ],
          "properties": {
            "canonicalPersonId": {
              "type": "string",
              "format": "uri"
            },
            "canonicalPortfolio": {
              "type": "string",
              "format": "uri"
            },
            "schemaGraphs": {
              "type": "array",
              "minItems": 2,
              "items": {
                "type": "string",
                "format": "uri"
              }
            },
            "sitemaps": {
              "type": "array",
              "minItems": 2,
              "items": {
                "type": "string",
                "format": "uri"
              }
            },
            "robots": {
              "type": "array",
              "minItems": 2,
              "items": {
                "type": "string",
                "format": "uri"
              }
            },
            "pagesMirror": {
              "type": "string",
              "format": "uri"
            }
          },
          "additionalProperties": true
        },
        "geoSignals": {
          "type": "object",
          "required": [
            "homeCountry",
            "serviceRegions",
            "searchModifiers"
          ],
          "properties": {
            "homeCountry": {
              "type": "string",
              "minLength": 2
            },
            "serviceRegions": {
              "type": "array",
              "minItems": 3,
              "items": {
                "type": "string",
                "minLength": 2
              }
            },
            "searchModifiers": {
              "type": "array",
              "minItems": 3,
              "items": {
                "type": "string",
                "minLength": 5
              }
            }
          },
          "additionalProperties": true
        },
        "generativeSearch": {
          "type": "object",
          "required": [
            "principle",
            "llmsTxtRole",
            "answerSources",
            "agentReadySurfaces"
          ],
          "properties": {
            "principle": {
              "type": "string",
              "minLength": 80
            },
            "llmsTxtRole": {
              "type": "string",
              "minLength": 60
            },
            "answerSources": {
              "type": "array",
              "minItems": 5,
              "items": {
                "type": "string"
              }
            },
            "agentReadySurfaces": {
              "type": "array",
              "minItems": 5,
              "items": {
                "type": "string"
              }
            }
          },
          "additionalProperties": true
        }
      },
      "additionalProperties": true
    },
    "aeo": {
      "type": "object",
      "required": [
        "preferredCitationOrder",
        "answerSnippets"
      ],
      "properties": {
        "preferredCitationOrder": {
          "type": "array",
          "minItems": 1,
          "items": {
            "type": "string",
            "format": "uri"
          }
        },
        "answerSnippets": {
          "type": "array",
          "minItems": 15,
          "items": {
            "type": "object",
            "required": [
              "question",
              "answer",
              "sources"
            ],
            "properties": {
              "question": {
                "type": "string",
                "minLength": 5
              },
              "answer": {
                "type": "string",
                "minLength": 20
              },
              "sources": {
                "type": "array",
                "minItems": 1,
                "items": {
                  "type": "string",
                  "format": "uri"
                }
              }
            },
            "additionalProperties": false
          }
        }
      },
      "additionalProperties": true
    },
    "triples": {
      "type": "array",
      "minItems": 20,
      "items": {
        "type": "array",
        "minItems": 3,
        "maxItems": 3,
        "items": {
          "type": "string",
          "minLength": 1
        }
      }
    },
    "schema": {
      "type": "object",
      "required": [
        "context",
        "person",
        "faq",
        "index",
        "pagesPerson",
        "pagesFaq",
        "generatedBy",
        "validatesWith"
      ],
      "additionalProperties": true
    }
  },
  "additionalProperties": true
}
