{
  "$schema": "https://raw.githubusercontent.com/Iron-Mark/Iron-Mark/main/public/schema/llms-index.schema.json",
  "version": "1.0.0",
  "updated": "2026-10-16",
  "contentRoot": "public/",
  "license": "https://github.com/Iron-Mark/Iron-Mark/blob/main/public/LICENSE.md",
  "citation": "https://github.com/Iron-Mark/Iron-Mark/blob/main/public/HOW-TO-CITE.md",
  "entity": {
    "@type": "Person",
    "@id": "https://www.marksiazon.dev/#mark-siazon",
    "name": "Mark Siazon",
    "alternateName": [
      "Iron-Mark",
      "mark-siazon"
    ],
    "jobTitle": [
      "Product Designer",
      "Full-Stack Developer",
      "Product Engineer",
      "UI/UX Designer",
      "Front-end Specialist"
    ],
    "description": "Mark Siazon, also known as Iron Mark, is a Philippines-based product designer and full-stack developer focused on inspectable case studies, AI workflows, mobile UX, Web3 trust flows, and client-facing web launches.",
    "url": "https://www.marksiazon.dev",
    "email": "marksiazon.dev@gmail.com",
    "address": {
      "@type": "PostalAddress",
      "addressCountry": "PH",
      "addressRegion": "Philippines"
    },
    "alumniOf": {
      "@type": "EducationalOrganization",
      "name": "University of Makati",
      "sameAs": "https://www.umak.edu.ph/"
    },
    "sameAs": [
      "https://github.com/Iron-Mark",
      "https://www.linkedin.com/in/mark-siazon/",
      "https://github.com/mark-siazon",
      "https://x.com/iron_markk",
      "https://twitter.com/iron_markk",
      "https://www.instagram.com/iron_markk/",
      "https://mark-siazon.notion.site/index"
    ]
  },
  "identifiers": {
    "person": "https://www.marksiazon.dev/#mark-siazon",
    "portfolioWebsite": "https://www.marksiazon.dev/#website",
    "githubProfilePage": "https://github.com/Iron-Mark/Iron-Mark#profilepage",
    "githubProfileIndex": "https://github.com/Iron-Mark/Iron-Mark#website",
    "githubPagesMirror": "https://iron-mark.github.io/Iron-Mark/#website",
    "faqDocument": "https://github.com/Iron-Mark/Iron-Mark/blob/main/public/FAQ.md#faq",
    "structuredIndex": "https://github.com/Iron-Mark/Iron-Mark/blob/main/llms-index.json",
    "wikidata": null,
    "wikidataGuide": "https://github.com/Iron-Mark/Iron-Mark/blob/main/public/schema/WIKIDATA.md",
    "entityGuide": "https://github.com/Iron-Mark/Iron-Mark/blob/main/public/schema/ENTITY.md",
    "indexSchema": "https://github.com/Iron-Mark/Iron-Mark/blob/main/public/schema/llms-index.schema.json",
    "personSchema": "https://github.com/Iron-Mark/Iron-Mark/blob/main/public/schema/person.jsonld",
    "faqSchema": "https://github.com/Iron-Mark/Iron-Mark/blob/main/public/schema/faq.jsonld"
  },
  "availability": {
    "status": "open",
    "focus": [
      "product design",
      "full-stack engineering",
      "AI workflow prototypes",
      "mobile and Wear OS UX",
      "Web3 proof systems"
    ],
    "engagement": [
      "contract",
      "part-time",
      "full-time"
    ],
    "location": "Philippines",
    "areaServed": [
      "Philippines",
      "Southeast Asia",
      "remote"
    ],
    "remote": true,
    "contact": "https://www.marksiazon.dev/contact",
    "recruiterBrief": "https://www.marksiazon.dev/recruiter",
    "headline": "Open to product design, frontend, and AI workflow roles",
    "summary": "Best fit: product roles, client builds, launch support, case-study packages, and mobile UX cleanup.",
    "firstMessage": "Share the role, problem, timeline, and work you want reviewed.",
    "note": "No public booking link is published; use the contact form so private details stay server-side.",
    "workScope": [
      "Product roles",
      "Client builds",
      "Launch support",
      "Case-study packages",
      "AI workflow prototypes",
      "Web3 trust flows",
      "Mobile UX cleanup"
    ]
  },
  "canonical": {
    "portfolio": "https://www.marksiazon.dev",
    "githubProfileReadme": "https://github.com/Iron-Mark/Iron-Mark",
    "techStack": "https://github.com/Iron-Mark/Iron-Mark/blob/main/public/STACK.md",
    "proofMatrix": "https://www.marksiazon.dev/proof"
  },
  "machineReadable": {
    "repo": {
      "llmsTxt": "https://github.com/Iron-Mark/Iron-Mark/blob/main/llms.txt",
      "llmsFullTxt": "https://github.com/Iron-Mark/Iron-Mark/blob/main/public/llms-full.txt",
      "llmsIndexJson": "https://github.com/Iron-Mark/Iron-Mark/blob/main/llms-index.json",
      "llmsCtxFullTxt": "https://github.com/Iron-Mark/Iron-Mark/blob/main/public/llms-ctx-full.txt",
      "faqMd": "https://github.com/Iron-Mark/Iron-Mark/blob/main/public/FAQ.md",
      "recruiterMd": "https://github.com/Iron-Mark/Iron-Mark/blob/main/public/RECRUITER.md",
      "proofMd": "https://github.com/Iron-Mark/Iron-Mark/blob/main/public/PROOF.md",
      "profileMd": "https://github.com/Iron-Mark/Iron-Mark/blob/main/public/PROFILE.md",
      "readmeMd": "https://github.com/Iron-Mark/Iron-Mark/blob/main/public/README.md",
      "howToCiteMd": "https://github.com/Iron-Mark/Iron-Mark/blob/main/public/HOW-TO-CITE.md",
      "licenseMd": "https://github.com/Iron-Mark/Iron-Mark/blob/main/public/LICENSE.md",
      "citationCff": "https://github.com/Iron-Mark/Iron-Mark/blob/main/public/CITATION.cff",
      "schemaPerson": "https://github.com/Iron-Mark/Iron-Mark/blob/main/public/schema/person.jsonld",
      "schemaFaq": "https://github.com/Iron-Mark/Iron-Mark/blob/main/public/schema/faq.jsonld",
      "schemaIndex": "https://github.com/Iron-Mark/Iron-Mark/blob/main/public/schema/llms-index.schema.json",
      "humansTxt": "https://github.com/Iron-Mark/Iron-Mark/blob/main/humans.txt",
      "stackMd": "https://github.com/Iron-Mark/Iron-Mark/blob/main/public/STACK.md",
      "sitemap": "https://github.com/Iron-Mark/Iron-Mark/blob/main/sitemap.xml",
      "robots": "https://github.com/Iron-Mark/Iron-Mark/blob/main/robots.txt"
    },
    "pages": {
      "home": "https://iron-mark.github.io/Iron-Mark/",
      "llmsTxt": "https://iron-mark.github.io/Iron-Mark/llms.txt",
      "llmsFullTxt": "https://iron-mark.github.io/Iron-Mark/llms-full.txt",
      "llmsIndexJson": "https://iron-mark.github.io/Iron-Mark/llms-index.json",
      "llmsCtxFullTxt": "https://iron-mark.github.io/Iron-Mark/llms-ctx-full.txt",
      "faqMd": "https://iron-mark.github.io/Iron-Mark/FAQ.md",
      "recruiterMd": "https://iron-mark.github.io/Iron-Mark/RECRUITER.md",
      "proofMd": "https://iron-mark.github.io/Iron-Mark/PROOF.md",
      "stackMd": "https://iron-mark.github.io/Iron-Mark/STACK.md",
      "profileMd": "https://iron-mark.github.io/Iron-Mark/PROFILE.md",
      "readmeMd": "https://iron-mark.github.io/Iron-Mark/README.md",
      "howToCiteMd": "https://iron-mark.github.io/Iron-Mark/HOW-TO-CITE.md",
      "licenseMd": "https://iron-mark.github.io/Iron-Mark/LICENSE.md",
      "citationCff": "https://iron-mark.github.io/Iron-Mark/CITATION.cff",
      "schemaPerson": "https://iron-mark.github.io/Iron-Mark/schema/person.jsonld",
      "schemaFaq": "https://iron-mark.github.io/Iron-Mark/schema/faq.jsonld",
      "schemaIndex": "https://iron-mark.github.io/Iron-Mark/schema/llms-index.schema.json",
      "humansTxt": "https://iron-mark.github.io/Iron-Mark/humans.txt",
      "sitemap": "https://iron-mark.github.io/Iron-Mark/sitemap.xml",
      "robots": "https://iron-mark.github.io/Iron-Mark/robots.txt"
    },
    "portfolio": {
      "llmsTxt": "https://www.marksiazon.dev/llms.txt",
      "llmsFullTxt": "https://www.marksiazon.dev/llms-full.txt",
      "humansTxt": "https://www.marksiazon.dev/humans.txt",
      "sitemap": "https://www.marksiazon.dev/sitemap.xml",
      "rss": "https://www.marksiazon.dev/feed.xml",
      "jsonFeed": "https://www.marksiazon.dev/feed.json"
    }
  },
  "featuredProjects": [
    {
      "name": "HireProof",
      "slug": "hireproof",
      "caseStudy": "https://www.marksiazon.dev/projects/hireproof",
      "live": "https://hireproof.tech/portfolio",
      "focus": "AI trust and safety for job seekers"
    },
    {
      "name": "Stellaroid Earn",
      "slug": "stellaroid-earn",
      "caseStudy": "https://www.marksiazon.dev/projects/stellaroid-earn",
      "live": "https://stellaroid.tech",
      "focus": "Web3 credential proof on Stellar testnet"
    },
    {
      "name": "ResQLink",
      "slug": "resqlink",
      "caseStudy": "https://www.marksiazon.dev/projects/resqlink",
      "repo": "https://github.com/UMakLumen/ResQLinkWeb",
      "focus": "Offline-first emergency response platform"
    },
    {
      "name": "LexInsights",
      "slug": "lexinsights",
      "caseStudy": "https://www.marksiazon.dev/projects/lexinsights",
      "live": "https://lexiph.vercel.app",
      "repo": "https://github.com/Iron-Mark/Hackathon-LexInsights",
      "focus": "AI legal compliance chat"
    },
    {
      "name": "Good To Live",
      "slug": "good-to-live",
      "caseStudy": "https://www.marksiazon.dev/projects/good-to-live",
      "live": "https://www.goodtolivepodcast.com",
      "focus": "Client podcast web launch and feed setup"
    },
    {
      "name": "FlowFit",
      "slug": "flowfit",
      "caseStudy": "https://www.marksiazon.dev/projects/flowfit",
      "focus": "Wear OS health and sensor companion"
    },
    {
      "name": "PalengkePay",
      "slug": "palengkepay",
      "caseStudy": "https://www.marksiazon.dev/projects/palengkepay",
      "live": "https://palengke-pay.vercel.app",
      "focus": "Stellar fintech PWA for wet markets"
    },
    {
      "name": "GawainYah",
      "slug": "gawainyah",
      "caseStudy": "https://www.marksiazon.dev/projects/gawainyah",
      "live": "https://gawainyah-minipay.vercel.app",
      "focus": "MiniPay AI utility with payment guardrails"
    },
    {
      "name": "BaybayInscribe",
      "slug": "baybayinscribe",
      "caseStudy": "https://www.marksiazon.dev/projects/baybayinscribe",
      "model": "https://huggingface.co/gilas/baybayinscribe",
      "focus": "Baybayin ML and cultural education UX"
    }
  ],